用户名,用户主页,推荐星级,评论时间,短评信息,投票次数,城市,用户签名
Mouse On Mars,https://www.douban.com/people/ish2/,推荐,2019-12-26 20:38:20,改编的结尾感觉有两面性，一方面可能拔高了男主角色高度，另一方面感觉削弱了反抗不公体制的力量。可能是为了过审，也可能是因为男孩死亡的过程对男主的影响。不过事后怎么处理的描写，不太符合男主的角色设定。那头羊其实不太好解释，原版里设定还比较合理一些。另，和喜欢的人一起看电影，真美妙,0,江苏无锡,新生
Anondot,https://www.douban.com/people/anonymousor/,推荐,2019-12-26 17:35:13,整体还行，就是特供版结局太伟光正，没意思。后来才知道这个是翻拍印度的，一查，印度自己也拍过两回。陈冲演恐怖片一定去看，吓人,0,上海,无签名
StevenSuen燚,https://www.douban.com/people/StevenSuen-/,推荐,2019-12-26 21:15:28,《误杀瞒天记》中国版。,0,江苏南通,富有理想主义，信奉自由主义
巴士底的猫,https://www.douban.com/people/goldene/,还行,2019-12-24 21:57:56,结尾改得烂透了。节奏控制的还可以，主要的都有，次要的做了取舍。解读的更清晰了，但少了些许乐趣。台湾腔实在是太让人出戏了。看过1000部以上的电影，很难再看到让人惊奇的电影了。6,0,北京,逝者如斯夫，不舍昼夜！
唔破司,https://www.douban.com/people/oopsisme/,推荐,2019-12-28 00:18:26,陈冲老师让我起鸡皮疙瘩,0,河南郑州,无签名
行走,https://www.douban.com/people/41540706/,还行,2019-12-22 07:09:18,不如原版的。明明都是中国人，却让故事发生在外国，他们都成了外国人，搞的他们一会说中国话，一会说外国话，甚至行政事务中也说中国话，感觉很拧巴！,1,未知,祝子
说撒呢,https://www.douban.com/people/179935953/,较差,2019-12-15 17:27:50,烂，导演对悬疑的理解还停留在过度的低音音效，升格镜头，最后的迷影致敬毫无意义。太水了…最后还是得正能量结局。。迷之煽情，说好的谷开来和熙来的剧情呢。。糟蹋东西,3,上海,无签名
熊喵喵,https://www.douban.com/people/34040685/,推荐,2019-12-28 16:36:51,没有风评的那么优秀，大概我对陈思诚成见太深了吧。陈冲是真的好，看豆瓣记录查案这点倒是蛮有创意的。,0,天津,一肚子不合时宜
凌睿,https://www.douban.com/people/lingrui1995/,还行,2019-12-09 15:07:33,"完全是原版《误杀瞒天计》的剧本的功劳，电影其实拍得很一般。
导演还自作聪明加了一个男主角删除监控录像的桥段，警方一恢复数据不就知道你在撒谎了吗？
而且真的不建议国内翻拍犯罪片，两部电影一对比，反而凸显国内审查严格得过头了。
《误杀》发生在泰国，《破·局》发生在马来西亚，《大人物》发生在虚构的滨海市。
演员都是中国人，说的都是普通话，何必要把背景设置为泰国？大家都懂。
当然也少不了男主角自首的结局，直接毁了整部电影。
原版男主角不仅没有自首，还把督察长的儿子埋在了警察局的地下，隐喻只有将腐败和黑暗踩在脚下，才能在上面建立起正义和公平。
本来电影表达的是，坏警察掌权、法律没有用的时候，也可以战胜黑暗势力。
你去自首，就仿佛在说：被性侵、被威胁千万不要反抗，因为万一把对方误杀了，那是要坐牢的。",11314,重庆,一个影迷
m89,https://www.douban.com/people/duzhouchi/,还行,2019-12-08 16:30:03,陈思诚是内地电影圈中难得的推理迷，自己搞搞贺岁擦边球，偶尔监制个本格些的作品，挺好。原来泰国也不想背锅啊，搞出来个架空的赛国…本来可以多给些分数，但结尾又忏悔又自首的，实在很太难顶。推理的部分看点不多，ATM的时间诡计勉强算一个吧，至于XX转移这种小儿科，也亏导演能渲染十分钟。陈冲的表演加分不少，不怒自威的气场稀释了肖央带来的喜剧感。,1676,"Port-au-Prince, Haiti",此生多寒凉 此身越重洋
铅纸鹤,https://www.douban.com/people/152377964/,推荐,2019-12-07 16:13:14,给我查他一年的观影记录！,7580,辽宁大连,无签名
亵渎电影,https://www.douban.com/people/zhangzongqian/,还行,2019-12-11 03:20:29,这版翻拍版的质量肯定是没法跟那两部印度版比了，就算把故事搬到了泰国，还是必须强拧一个大家懂得的那种中国国情版结果，这时候电影的主题早就不是原版的主题了，深度也自然没法跟原版比了。因为有原版的故事打底，这部翻拍版在犯罪悬疑的剧情上还是可以看的，还加入了一些迷影元素。陈冲直接查肖央一年内的观影记录，就能火速破案实在是太二了，查出来的那部韩国电影《蒙太奇》也是确有此片，这里面“高智商犯罪蒙太奇剪辑”的逻辑是不是严谨，那就是另一回事了，大家跟着快节奏的剪辑兴奋一下就行，不必深究，只有ATM取款机那一处蒙太奇是亮点。当然，这部也没将重心放在高智商蒙太奇上，而且把主题变成了民众对抗社会公权力，但最后的那个你懂的结尾，其背后的逻辑让人细思极恐。,1234,北京,I’m back!
影志,https://www.douban.com/people/tjz230/,推荐,2019-12-11 00:56:33,“没有平局，我们只能做赢的那一方” 霸气的国产类型片，即便翻拍，也不失硬朗。那句“给我查他一年的观影记录！” 真是笑死了，你还能咋查，不就是上豆瓣吗？哈哈哈哈,4339,北京,无签名
草威,https://www.douban.com/people/Cao-Wei/,推荐,2019-12-14 21:39:23,看过100部国产电影你就会知道，没有什么故事是一个特色结局毁不掉的。,1755,北京,错喜欢
无耻不混蛋,https://www.douban.com/people/miumiu-li/,推荐,2019-12-08 15:50:15,"我没想到，今年最让我看得过瘾看得“爽”的国产犯罪片，居然是这部《误杀》。虽然改编自印度《误杀瞒天计》，却融入了很多日韩电影精气神，算是靠谱的改编方式。大量推理细节和线索都被保留，在犯罪开始之后节奏紧张刺激到停不下来，破案解谜的爽感逐步递进，近年来国产犯罪片不少，但能这样拍实属难得。影片对手戏好看，肖央vs陈冲，陈冲vs谭卓，陈冲与谭卓自不必说，更让我刮目相看的是肖央，《老男孩》后，这部才是他真正有份量的作品。
",2071,北京,无签名
谋杀游戏机,https://www.douban.com/people/hexiaoqin/,立荐,2019-12-09 00:31:00,陈冲的表演太好了，不怒自威。新加那句”查他观影记录“太逗了，豆瓣网友怕是藏不住了。,367,北京,众生皆苦，肥宅快乐
不良生,https://www.douban.com/people/angle223/,推荐,2019-12-07 22:33:31,鸽子飞不过塔顶，替罪的永远是羊，我们误杀他人，也曾被他人误杀，尘世永远有正义抵达不了的地方。看得很爽，因为希望男主一家逃脱漩涡，公道比律法更有分量；看得哀伤，因为无论孩子是天使还是恶魔，都有一个父/母对ta爱到发狂。反杀反转很爽，庆幸这没有发生在我们的领地上，可惜这没有发生在我们的领地上。,2129,江苏南京,http://weibo.com/angle223
metaphor17,https://www.douban.com/people/metaphor17/,还行,2019-12-10 21:38:55,感觉这电影特别自作聪明，也就能骗骗吃瓜观众。观影量1000+的观众应该都不会吃它这套吧，男主角选肖央真的是此片一大败笔，估计是陈思诚喜欢？,243,北京,不过是 骗人的把戏
桃桃林林,https://www.douban.com/people/qijiuzhiyue/,还行,2019-12-16 12:35:18,背后的指涉还是挺有趣的，放在泰国就可以为所欲为了呢。原来看电影还有这个功效，感觉自己这么多电影白看了。,138,"P'yŏngyang, North Korea",微信公众账号： ttfilm
Janie,https://www.douban.com/people/55300712/,还行,2019-12-09 22:14:50,個人覺得到懺悔塔那裡結束就差不多了，後面強行升華的結局毀了所有,276,广东深圳,以中有足樂者
嘟嘟熊之父,https://www.douban.com/people/duduxiongzhifu/,推荐,2019-12-07 16:23:42,好于印度原版，将不痛不痒的现实主义裹脚布改造成高度浓缩的社会寓言。羊命、蒙太奇、架空国度、多重人物身份，可以置放在任何政治语境下进行解读。对准面孔的长久凝视，是试探和挑衅，也是控诉和审判。陈冲太猛，狰狞的表情犹如恶魔附体。,1648,北京,谁来拧动拧发条鸟的发条
鹿鸣,https://www.douban.com/people/108146760/,推荐,2019-12-06 00:42:34,开篇米黄色的监狱场景《监狱风云》，越狱《肖申克的救赎》，棺材里点火《活埋》，出现的电影还有纽约五行杀人案《唐人街探案2》，用演技脱罪《控方证人》，镜头剪辑《蒙太奇》，唯一提到的电影人悬疑片大师希区柯克，棺材盖上的抓痕《妖猫传》，在电影院看的电影是《天才枪手》，出现了两张海报，一张《肖申克的救赎》一张小李子主演的《猫鼠游戏》，查观影纪录的电影有： 撒谎的萝莉《狩猎》、宗教犯罪案《七宗罪》、日与夜的相守《白夜行》。最后面对摄像机的镜头《杀人回忆》，核心诡计是《蒙太奇》，暴乱戏能够联想到《小丑》，小女儿看到妈妈埋人的镜头《唐人街探案》，囚车的戏《我不是药神》，标准的国产犯罪片的和谐大结局《暴烈无声》等。一部迷影向的电影，7.5/10,1148,安徽合肥,无签名
方枪枪,https://www.douban.com/people/yalindongdong/,推荐,2019-12-09 12:43:24,既保留了原版最扣人心弦的部分：缜密的故事设计和离奇曲折的各种反转桥段，也做出了属于自己风格特色的改变，情节紧凑，节奏干净利落，尤其是演员的表演，无论是肖央，还是谭卓、陈冲，都让人惊喜。当然，给我查他一年观影记录台词一出，影厅直接笑场，太豆瓣了吧，哈哈哈哈。PS：估计很多人并不知道，《误杀瞒天记》也是翻拍，翻拍自2013年一部名为《较量》的印度电影，只不过比《较量》名气更大而已。,1379,上海,Life is wonderful !
大奇特(Grinch),https://www.douban.com/people/grinch/,还行,2019-12-06 21:36:33,《误杀瞒天记》（同样翻拍自《较量》）的基础在那儿，首先解决了原作前40分钟啰哩啰嗦的问题，整体节奏加快。除了外景搬到泰国以求安全，影像风格也很泰式。误杀段落与跆拳比赛的平行剪辑用的也好，这些都是优点。美中不足的是肖央刚出场时总带股喜剧味，警察搬“观影记录”查案也很儿戏（“豆瓣看过”将成为最有效的证据），总给人一种想往喜剧上走的错觉，结尾的“安全牌”大家都懂。,136,北京,肚脐缝顾肠胃
徐若风,https://www.douban.com/people/ruo1996/,推荐,2019-12-05 23:18:18,对新导演而言，算是一部出色的类型片处女作。剧作遍布反转和算计，有意将背景设置在一个警员欺下瞒上、局长滥用职权的环境下。两个家庭围绕一场骗局的对抗背后，其实是两个阶层的斗法，一则社会寓言。几位主演，尤其是肖央、陈冲、谭卓三位，表现出彩，展露出了每个角色的复杂多面。迷影的元素很有趣，尤其是陈冲那句“给我查，把他近一年的观影纪录都查出来”时，不禁笑场了，这实在是个亲切的“豆瓣时刻”。,941,浙江杭州,24.
时间之葬,https://www.douban.com/people/ydyie/,推荐,2019-12-04 22:44:36,比想象中更好，在今年的华语犯罪片里绝对是一个无法忽视的存在。整部电影构建了一个看似简单实则极其精妙的“骗局”，让看似软弱无力的李维杰一家，完成了惊人的逆转和反杀。戏里李维杰与拉韫的斗智斗勇，像极了两个犯罪心理高手的对弈，戏外肖央和陈冲也在比拼难分高下的演技。更难得的一点是，导演把这样一个故事放置在一个社会治安混乱，警方失信于人民且滥用职权的架空背景下，于是李维杰一家的反抗，便有了几分耐人寻觅的意味，最后的高潮与收尾，也让这种浓烈的情绪得以慢慢宣泄出来。另外想提的一点是，华语片里终于也植入了数不清的迷影梗和彩蛋，有兴趣的影迷朋友可以动手盘点起来了。,785,北京,无签名
晚不安,https://www.douban.com/people/yellowmoonbird/,较差,2019-12-05 23:03:57,第一个想到看电影学破案的是天才，第二个是庸才，这种级别的翻拍只能是蠢才了。导演好像刚学完升格镜头似的，从头到尾照死里用。又土又蠢，还不如那期瞎看精彩。看过一千部电影，还是觉得这个世界很离奇，比如这样没有创造力的东西为什么还会被拍出来。陈冲的人设在公私两个层面很割裂，有一个长镜头克制情绪而不能的表演不错，其他炸裂式演技都太过火，但她是这部电影里唯一的看点（原来许文姗是她女儿…）。雨中那场戏的造型感下了一定功夫，但就是一个招数来回用。——头脑不够聪明，心肠又不够狠毒，所以无聊透顶。最后，年观影八百部，打印年度观影记录，念剧情简介，豆瓣鹅真实地笑了。,569,北京,君子固穷
胖官赵,https://www.douban.com/people/122454843/,较差,2019-12-13 12:23:49,一家人完全不像一家人，假的要死，根本融入不到这个故事中。影迷这个梗到底是在羞辱谁？,220,北京,无签名
天边最美的云彩,https://www.douban.com/people/135145248/,还行,2019-12-09 15:36:51,赌的风险太大了，1 要路人们都记忆模糊，2 要监控器清除数据确定无法恢复，3 要连小女儿都准确表达，能成功也说明警察是真心无能。但好在这么多的bug都不影响观影体验，比起肖央电影中展示出的蒙太奇手法，显然电影本身剪辑就足够惊艳。烧脑推理题材天然就有受众，但国产片陈思诚愿意带着新导演好好拍认真拍还是挺不容易的。,160,北京,无签名
朝阳区妻夫木聪,https://www.douban.com/people/Invisible___/,较差,2019-12-11 13:35:22,也就是一篇《故事会》级别的爆款爽文，所有人物心理的转变基本全都靠台词的全盘托出，很难说服人，这样一个翻拍的剧本真的有必要需要六个编剧吗？看的过程中仿佛能够感受到陈思诚一脸自豪地躲在镜头后面油腻的笑：怎么样看我这个设计是不是很牛逼？没想到吧！先是《双瞳》再是《蒙太奇》，看我阅片量大不大！你们看这片，多悬疑啊！,138,北京,靠脸吃饭
小然Raner,https://www.douban.com/people/75672989/,较差,2019-12-07 21:27:36,"非常不喜欢的一次翻拍，不伦不类，既然翻拍为什么不能好好的本土化呢？非得一会泰语一会中文，结尾再来个英文，呦呵，真是个国际大都市。

另外一点就是逻辑有着很大的问题，尽管利用蒙太奇的手法，但是这过程处理的太模糊了，多多少少有点搪塞，其次影片很厉害，让你看不出这个故事发生在2019年，这场景，这打光，真是不知道到底是怎么想的。

这个结局也是不能接受，虽然说为了符合社会主义核心价值观，但这样的处理让前边所有的内容全都变成了泡沫，那做这些的意义何在？

最想吐槽的还是，为什么两个中国人生出一个泰国女儿，真是当观众是傻子，二星半。
",125,山东淄博,无签名
陀螺凡达可,https://www.douban.com/people/cabaret/,还行,2019-12-19 23:15:22,快找陈冲去演恐怖片。,103,"Paris, France",慢性死亡
小明明,https://www.douban.com/people/4621746/,力荐,2019-12-07 21:35:57,我想说这应该是我看到的2019年最好的国产商业片了。这是不是佐证了肖央是唐人街探案里排行榜第一的Q？,3499,"Auckland, New Zealand",无签名
猫奴十二年,https://www.douban.com/people/IvanLaw7/,很差,2019-12-05 20:43:20,正在看，看了一个钟头，一星不可更改。镜头语言缺乏力量感，全靠背景音乐来凑，整得跟电视剧一样，点进导演主页看，还真拍了唐探电视剧。剧本上第一幕完全是学生水平，什么都往里面堆，东一榔头西一棒子。中间点后不想仔细看了，无非就是影迷大战警察，看着好故事一步步被毁掉真是痛心,205,Antigua and Barbuda,当你不开心时，带猫前行
法棍老人,https://www.douban.com/people/christan1987/,还行,2019-12-07 00:24:47,正确的观影顺序：《较量》(印度 2013)------《误杀瞒天记》(印度 2015)------《误杀》(中国大陆 2019),87,"Zürich, Switzerland",坂本·德彪西
Jupiter,https://www.douban.com/people/131753555/,较差,2019-12-12 01:05:22,"1.按道理可以给三星，但是看到众多恰饭的影评人实在是恶心得不行。
2.片子是不是没有给调色师预算？颜色相当糟糕，看着一度想退场。
3.太刻意，槽点太多，经不起推敲。",96,广东深圳,无签名
年少成名秃头驴,https://www.douban.com/people/Len./,还行,2019-12-13 21:26:35,拿着个印度剧本韩化，特别有些分镜、画面感，太韩式了。原来是迷影电影，就差没致谢豆瓣了……所以戏外反豆瓣还真挺迷的啊。最后能提前十分钟结束多好……这个结局比加字幕强行正义更糟，都不知道搞的什么。,57,Christmas Islands,无签名
冰镇西瓜橘子水,https://www.douban.com/people/65400706/,推荐,2019-12-13 20:23:52,陈冲质问小女孩那段给我看出心理阴影来了,543,江苏南通,活在裆下
0,https://www.douban.com/people/148291533/,还行,2019-12-10 21:11:08,大陆资方请马来西亚华人导演在泰国翻拍了一个印度电影，肖央在其中饰演宋康昊。,65,北京,需要时，给我打电话
鄙伶,https://www.douban.com/people/67242863/,很差,2019-12-05 18:16:44,"1.5 这片辱看过1000部电影以上的观众了，吓得我赶紧把标记看过的片删到1000以下，片子提醒友邻要注意了，小心哪天大数据分析你阅片记录......导演怕是网大系导演吧，叙事、剪辑太不行了，想致敬一堆经典悬疑片，整体又显得很突兀，结尾为了“过审”而结尾就算了，但最后一个镜头强行抄《杀人回忆》？整部片用冯小刚的话说就是：“还蒙太奇，你知道什么叫蒙太奇呀”。点映直接掐片尾字幕，彩蛋都没看着

如果把地域设定在大陆而不是泰国，👮也是大陆的话，片子就没法过审吧",153,福建龙岩,不是影迷只是观众
爱玩电影的人,https://www.douban.com/people/142084334/,力荐,2019-12-07 21:59:59,精彩！甚至超出原版！情节更加紧凑！如果很爱电影的人看这部电影一定很爱这部电影。虽然看过一千部电影和破过一千个案子比较，显然前者更为逊色，但依靠蒙太奇就能做出一条完整的证据链，实在惊艳！各位主演演技水准之上，镜头把控节奏带感，雨中认尸一段慢镜头的使用特别值得玩味！另外结尾处理得相对合理，但还是稍显突兀。最后采访一段的留白也有韵味。近年翻拍的上乘之作。,1705,"开平, 江门",独立影评人
有心打扰,https://www.douban.com/people/kejinlong/,推荐,2019-12-06 20:42:16,用电影《蒙太奇》的手法演绎出另一款《嫌疑人X的献身》。节奏不错，还挺好看，哪怕是国产片中最令人害怕的慢镜头在本片中都运用得不错。,655,福建泉州,好想爱这个世界啊！
我不是盆栽啊,https://www.douban.com/people/baixg/,立荐,2019-12-10 22:14:22,中国过审式改编是对观众审美的一次大型侮辱。,52,"Ulan Bator, Mongolia",closed permanently
壹安²,https://www.douban.com/people/rayland/,力荐,2019-12-09 14:29:52,应该是今年贺岁档最有劲儿的一部电影了，题材很大胆，父亲很勇敢，惹了惹不起的，知道瞒天过海也会露馅，于是给自己留一招必杀技做后路！虽然有几分理想状态，但确实年度解气！最后一定要表白陈冲老师，气场这个东西不是随便哪个“戏骨”能驾驭的。,435,北京,Just Like Fire
把噗,https://www.douban.com/people/babulliu/,推荐,2019-12-10 22:01:25,不错。拍得挺精致，屁民通过电影的知识赢得了胜利，既是现实也是隐喻：观影成为我们这个时代最重要的自我教育手段。说点有趣的，这部电影是不是证明了观影量的重要性，并且在不远的将来，豆瓣有望成为破案数据库？,382,北京,Festina Lente
内陆飞鱼,https://www.douban.com/people/veverlee/,推荐,2019-12-12 09:16:00,喂，肥宅，你看那么多电影有用吗？万一有用呢，难说就是一招制敌的杀手锏了。,331,云南昆明,因雨成歌
行所在,https://www.douban.com/people/roczhen/,较差,2019-12-12 09:20:26,翻拍国外的片子，故事依然发生在国外，这也是中国式奇葩,66,北京,无签名
谢谢你们的鱼,https://www.douban.com/people/reave/,还行,2019-12-11 22:34:48,很失望，除了肖央的表演和完成度还行的改编剧本，其余部分都很没意思，甚至把原版最后的爽片氛围给推翻了。第二幕的斗智斗勇之后，整部电影不论是情绪还是戏剧张力都在极速下降，导演除了音效和jump scare再也想不出别的营造氛围的方式，而原创部分，不论是《蒙太奇》的提及还是羊的隐喻都生硬得一批。最可怕的是，我从头到尾都没有觉得主角的家庭是成立的，同理，环境的描写也不让人信服，看着非常别扭。,47,北京,无话可说
筱桑,https://www.douban.com/people/68023776/,推荐,2019-12-11 00:01:17,结尾的忏悔自首毁所有。4星全给前面，就当我没看过结局。,204,"Baghdād, Iraq",无签名
无机客,https://www.douban.com/people/tensor/,很差,2019-12-07 15:53:52,真是垃圾結局，浪費了一個好劇本。,113,浙江嘉兴,倒计时开始了
不脱袜子同学,https://www.douban.com/people/lelio/,推荐,2019-12-10 22:52:26,真是一部很适合豆瓣影迷的电影，看完之后大胆设想，要是以后警察办案真的要查观影记录了，该咋整呢😂不喜欢首映上蒋方舟的点评，她说觉得平平（陈冲的女儿许文珊饰）长得挺壮的应该能轻松制服素察，此刻的蒋老师仿佛变成了她曾经吐槽过的油腻直男，对年轻女性的身材指手画脚，永远不要从受害者身上找问题。而且，这还是部电影呀！请让电影回归电影，把话语权还给影迷，以后看电影多做笔记，记好知识点！,150,北京,飞向太空，宇宙无限
陆支羽,https://www.douban.com/people/luzhiyu/,推荐,2019-12-10 22:57:41,1.难得有一部犯罪悬疑片能跟迷影精神命脉相连，这固然离不开原作的品质，但国产改编能够抵达这样的水准已属上乘。2.角色无大小，谭卓真的演活了一个表面细腻隐忍、内心波涛暗涌的女性角色；戏份不多，却闪着弧光，尤其是她跟陈冲飙戏时说出的那句“有的孩子是孩子，有的孩子是禽兽”，完美展现了一位看似懦弱胆小的母亲，是如何在家庭命运的关键时刻出离愤怒、捍卫尊严的。3.陈冲则依然充分施展了她的神演技，而肖央同样经历了一场蜕变。,217,北京,死前看大海，是每个灵魂的夙愿。
武侠小王子,https://www.douban.com/people/china-undead/,推荐,2019-12-07 10:08:31,"一场因身份差异而引发的误杀，电影在事件背后所展现的阶层对立、正义缺失以及公权私用，或许更让人触目惊心。

公权力左右下的正义举步维艰，其实比起电影案件所引发的戏剧冲突，背后关于正义的声讨更能动人心扉。

尤其在一个混乱之地，公平正义成为了每一个平民穷极一生争取的生存底线。电影中则把对立冲突渲染到了最大化。

电影在肖央陈冲谭卓的共同努力下，《误杀》饱满深情，不失为一部诚意之作。",366,江苏南京,云在青天，水在瓶。
七海,https://www.douban.com/people/144459333/,推荐,2019-12-09 02:59:58,蒙太奇的手法，心迷宫的人性，一千部电影 一千种案件，局外人看世界 非黑即白，拳台下赌命赛 生死时速，镜头设计很有趣，陈冲和谭卓飙戏好爽，瑕不掩瑜 看看会有惊喜的！,238,广东广州,无签名
阿卜,https://www.douban.com/people/shiguagji/,力荐,2019-12-08 15:54:02,卧槽！可以说是今年看到最好的华语电影！没有之一！看之前没有关注过这部电影是翻拍，但即便是补档了印度前作《误杀瞒天记》也依然觉得这部更出彩。原作的配乐实在hold不住，并且原作的影片节奏完全不及这部，再剪掉四十分钟都不成问题。尽管依然有些不尽如人意，但《误杀》称得上是“站在巨人肩膀上”。,195,广东广州,Don't panic！
刘小黛,https://www.douban.com/people/darlingtudai/,推荐,2019-12-08 21:32:21,印度电影改编翻拍，高概念反杀片，题材新锐，故事紧张，伏笔丰富。肖央用眼神演戏，谭卓和陈冲演技突出。背景架空，有很多值得玩味之处。高智商犯罪，推理过程连续烧脑，衬亲情之味。警察制度社会生态方面针砭时弊。结局秦沛采访一幕，饶有余韵。,230,江苏无锡,美酒醇妇庶几完满。
