用户名,用户主页,推荐星级,评论时间,短评信息,投票次数,城市,用户签名
尹宇豪儿,https://www.douban.com/people/169342001/,推荐,2019-12-09 15:03:25,看的点映。全片看完后炸裂了，架空的城市满足了我们所有曾经想过却不敢实施的事，利用电影来指导我们生存。电影完成度太高，但结尾却还是因为某种因素增添了不该有的部分，应该在佛那里就可以收了，所有的自首看似是为了人性挣扎过后的解脱，实际上是某某因素。,1,湖南长沙,无签名
子皿与舟,https://www.douban.com/people/haaaaaaaa/,还行,2019-12-24 16:54:09,诸多不合适宜的细节堆在一起，但有一种莫名其妙的完成度。神奇神奇。,0,北京,生于忧患，死于拖延
Chloe,https://www.douban.com/people/chloechen/,推荐,2019-12-17 12:54:14,如果镜头上摇到青天白日大佛塔就收，会更好，但恐怕过审会有困难,0,浙江杭州,生命要浪费在美好的东西上面
sam,https://www.douban.com/people/samsyu/,还行,2019-12-07 19:07:21,3.5电影经验和实操直觉拉出来打架，说白了就是没吃过猪肉还没见过猪跑。有些配乐段落特别mv，就当作点题蒙太奇吧...整体的推理和悬疑设置都合格，但放着孩子被侵犯的事不管直接高智商犯罪个人秀，还是有些太直男了。至于阶级和警圈，其实可以指涉任何一个国家，但结尾的煽动性太强了。可以看作是唐探延伸系列，相信还有续作。,1,江苏苏州,还是要活得生动
四夕中心,https://www.douban.com/people/173004718/,很差,2019-12-11 21:39:24,"印度电影《误杀瞒天记》是部手把手的教你如何面对警察做假口供，教你如何制造自己不在犯罪现场的证据，如何逃脱法律制裁的电影。

当你不小心犯罪了，第一件事就是别慌张，赶紧去看这部印度版的《误杀瞒天记》，你绝对还有重生的机会，但如果你去看中国翻拍版的《误杀》，你就死无葬身之地了。

《误杀瞒天记》之所以没有引进到中国来上映，是因为通不过审查，通不过审查的电影翻拍成中国版，大家应该明白要阉割掉多少原版的精华，才能通过审查。所以，稍微有点脑子的影迷，肯定不会去电影院看中国版的《误杀》。",4,福建福州,无签名
WEY,https://www.douban.com/people/33839398/,推荐,2019-12-15 23:45:49,谭卓不输陈冲。为了龙标不得不改结局，还是不够解气。,1,湖南长沙,内骚加外骚。恣意生存。
明光暗影,https://www.douban.com/people/145849529/,还行,2019-12-03 18:32:43,印度版的发生地是在印度，中国版的发生地疑似是在泰国（片中称之为赛国）。因为发生地是法律混乱、警察贪腐的地方。除了为加强情绪将偷拍改为性侵之外，剧情基本一致。当然，结局又是要改的了……就像该片中所提到的韩国片《蒙太奇》，中国版《你是凶手》仍在上映中，也是改了结局的。毕竟，国内大银幕不允许“违法”的结局。ps:中国版演员也不错，男主的性格变化最大，印版沉默内敛冷静理性，中版因为是肖央，所以…更活泼了吧。整体不如印版，但依旧推荐看！比如片子短节奏较快。。。,5,未知,无签名
Elika,https://www.douban.com/people/zhaoyajing/,推荐,2019-12-11 21:30:23,对于国产悬疑是很好的。,0,"Tel Aviv-Yafo, Israel",I'm pretty
牛佬,https://www.douban.com/people/sampaning/,推荐,2019-12-15 15:07:38,拍成这样已经挺好了。类型把握的很准了，有感情，有技巧，节奏OK，几场审问、对峙都不错，影迷设定也好玩，最后有点煽过头了。陈思诚很厉害。,0,北京,Byebye噢，Byebye啦……
沉默的海浪,https://www.douban.com/people/graceguo/,较差,2019-12-23 21:05:45,陈冲这么好的演技，在这部片子里浪费了，小女儿也演的好。故事和故事氛围有种说不出的奇怪，悲剧主题但时不时地出现喜剧氛围。韩国拍的社会问题片，反映现实并激发观众严肃、认真地思考；印度拍的社会问题片，很多都充斥着大量喜剧细节和结尾，特意淡化矛盾和悲剧主题，看起来没那么深刻的悲剧体验，最终却感觉智商和情商都被愚弄，因为故事情节和感情基调都搞得四不像。总之，剧情不能细想，最好想都别想……不然很多人设瞬间崩塌。在泰语和汉语下，后半段突然响起一首英文歌……虽然好听，但出戏又尴尬（这段是不是印度原片残留啊？可背景改为越南了呀）。结尾可有可无，却还做做地刻意卖关子。难怪结尾还没出，有的观众已起身打算走了……,0,上海,星辰大海 人间烟火
Avalon,https://www.douban.com/people/allblue/,推荐,2019-12-17 17:12:32,翻拍就要这个水平！,0,河南郑州,一定要宅出达摩的境界！
湘雨,https://www.douban.com/people/138166585/,力荐,2019-12-16 18:15:58,看的过程中一直揪心。我宣布我是肖央的粉丝了。演技都挺好的。素察母亲一度吓到我，恐怖的眼神。最后大雨里掘墓的那场戏，音乐、镜头看得相当震撼。    自首自动忽略了。就该结束在那个印度佛塔前。,1,山东青岛,无签名
胡二,https://www.douban.com/people/hulangbaiyue/,推荐,2019-12-14 22:55:15,除了查观影记录有点尴尬，其他都挺好,0,北京,无签名
漂泊的风筝🇨🇳,https://www.douban.com/people/56679873/,推荐,2019-12-21 21:03:25,"对这部片子感兴趣完全是因为谭卓在《天天向上》上“丧心病狂”地自己cue自己。
破绽还是有的，比如观影记录之类的。把《蒙太奇》《嫌疑人X的献身》《看不见的客人》捏起来综合了一下。
我还是挺喜欢的，对肖央的看法有改变。
最后的结尾我感觉有点迷，不知道是为了过审还是想要拍续集，明明在佛塔下就可以收尾了。
ps.可能是我的问题，不觉得平平好看，也没有少女感。用我的家乡话说这个女的长的真“大膀”。",0,"Melbourne, Australia",无签名
Devlali Number,https://www.douban.com/people/120060064/,推荐,2019-12-13 22:44:40,"虚构地点的好处就是可以让社会矛盾伴着主人公的情绪彻底爆发出来，而且群众动乱这条线铺得也挺清楚，这样一来即便是到了主人公决胜时刻时还是捋不清时间线上的蒙太奇，也不妨碍在那一刻被煽动起来。

这片子涉及的问题随便挑一个出来放在现实中都是那种会引起舆论漩涡的争议问题，所以我就更喜欢片尾那个群访和那个凝视观众的眼神了。",0,北京,什么什么？听不清啊！
cccddw,https://www.douban.com/people/64922184/,还行,2019-12-08 16:23:03,整体质量真的不错了，比预想的还要好点。肖央谭卓陈冲的演技都很好，就是长得像吉克隽逸的大女儿有点拖后腿。（结尾emm……可以理解，但还是要扣一星）,1,广东广州,无签名
pandora刀刀,https://www.douban.com/people/pandoranavi/,还行,2019-12-06 23:37:45,比我预计的好看。,1,北京,刀刀 叨叨 $$. Soy Sonia~
好嘢！,https://www.douban.com/people/iamsyh/,推荐,2019-12-05 22:46:28,没看过原版，但是看过原版的电影解说。在故事主要元素已经知晓的情况下，表演和故事节奏能把故事立起来、抓住观众，所以算是不错的翻拍。陈冲和谭卓两位母亲的演绎都非常扎实，一个让人恨得牙痒痒，完全相信她就是这种人；一个让人心生怜悯，觉得她确实经历了这件骇人之事。片尾彩蛋暗示开头就是那什么的我也是real接受不了，但是导演无疑是有追求、动脑子了。就冲这点我给个推荐。,2,广西防城港,Nobita & Doraemon
sTill-Life,https://www.douban.com/people/yystilllife/,推荐,2019-12-20 22:27:50,冲着导演柯汶利来的，确实是类型片好手，短片《自由人》中表现出来的优点和缺点到了第一部长片里同时被放大，太多匠气成了最大的问题。还是愿意多给以一星以示鼓励。大女儿平平每一次抬头都误以为是刘晓庆，也太像了吧，一翻演员表竟然是陈冲的女儿……另外就是警察查观影记录，怕怕,0,上海,唯爱与自由为毕生所求
酸辣小星星,https://www.douban.com/people/xiaoxingxing/,推荐,2019-12-20 20:04:07,我觉得最后爸爸自首没什么问题。无论什么原因，犯罪了就是犯罪了，就应该受到法律制裁，这才体现法律的公平性。电影挺好看的，环环紧扣，演员演技全体在线。陈冲的演技绝了，谭卓也很厉害，两个女人一个狰狞凶狠一个坚决勇敢对视互怼的那一段真的是太棒了。那小女孩也可以的，被审讯的那段看得我心都揪紧了。,0,江苏无锡,人因为梦想而伟大~~~
AZWayne,https://www.douban.com/people/60307113/,还行,2019-12-13 14:20:34,看1000部电影终究比研究1000个案件有用。翻拍外国电影不是华语电影的悲哀，翻拍还要把背景放在国外才是华语电影真正的悲哀。,2,山东济南,无签名
哈里破特,https://www.douban.com/people/lanodg/,推荐,2019-12-24 23:42:06,肖央真是惊喜，虽然一直看起来还是那么衰。毕竟也是好演员。演员很辛苦啊，陈冲要给小女孩留下心理阴影诶。结尾解释太多，直接结束反而意犹未尽让人叹服,0,四川成都,心有猛虎，细嗅蔷薇。
伊夏,https://www.douban.com/people/JoGreen/,推荐,2019-12-05 21:01:12,超前点映。商业片来说，完成度不错，背景放在泰国（但片里换了虚构国名）很聪明，针砭警察和政客都稍微放得开些。视听效果上，药神和唐人街气息颇重，陈思诚或肖央这类主创的个人特性“有毒”。正式上映后应该会有挺多角度可供宣传的，敏感的不敏感的都有……,1,"Manaus, Brazil",在硝烟中想起冰棒汽水的味道
ANT1FLAG,https://www.douban.com/people/44452876/,较差,2019-12-21 21:17:06,结尾改变中国特色＋巧妙，是唯一值得称道的点。视听狗屁慢动作恶心。,0,湖南长沙,请勿用难以理解的文字填写签名档
街坊饿霸,https://www.douban.com/people/4400048/,还行,2019-12-13 16:38:40,还原的还不错。陈冲魔警印象深刻。,1,未知,读书看电影是为了学以致用
在月球上荡秋千,https://www.douban.com/people/Oumuamua/,还行,2019-12-19 23:49:53,还不错,0,北京,大海啊你全是水，骏马啊你四条腿
Gillian,https://www.douban.com/people/57553879/,推荐,2019-12-16 15:34:17,大女儿演技拖垮全员……小女儿演得超好！,1,上海,无签名
St.Me,https://www.douban.com/people/redvon/,推荐,2019-12-24 00:59:15,"最近刚好读到一句话“这个世界，表面上尊重规则，实际上只尊重赢家。”

说句激进点的话——强奸犯被判活埋难道不合适吗？",0,北京,Take it if you see it.
两江狐子,https://www.douban.com/people/hsuperhat/,推荐,2019-12-15 02:13:19,今年看的最“名副其实监制”之一，制作令人佩服，剧本改得漂亮，至少作为本土观众从难以被剧情介绍吸引变得略有好奇并且看了。不过所谓的本土化，其实是打折扣的，毕竟故事背景在内容上更擦边球一些的泰国。这属于犯罪类型片里的“战术犯罪”吧，还相对少见，常见是在小说里，所以对我来说还是新鲜的。开场节奏和表演一般般，甚至感到不对劲。三分之一后渐入佳境并且直线飙升，强设定啊，强推动啊，夸张表演啊，突然所有都对了，什么都对，魔性啊。两个点有真实刺激到我，一是拉韫在餐厅出现那一瞬间，二是棺盖上的血迹。剧情一眼即穿，组装得好啊，剪辑包括声音剪辑功不可没，视听牛逼，抗议的情节和结尾才是最厉害的，大放大收，未点破，却加深扩展了主题。细节动人。扣分主要因为开场，还有宗教这部分过多的设计。三星半,0,北京,Vivere non est necesse.
信电影得永生,https://www.douban.com/people/38897761/,推荐,2019-12-14 00:18:42,"误杀之泰国版。中国版怎么能这么拍？先通过审查再说吧。
话说这是一部迷影片。都直接背电影台词了不说，还向《杀人回忆》致敬两次。
陈冲又狰狞又飒，谭卓伤心欲绝有力量，两人演技太牛，还来个正面交锋。小女孩也太有镜头感了。
是个好故事，不过结尾也太和谐了。
三星半",0,广东深圳,看电影是一场精神自由的旅行
神哥,https://www.douban.com/people/62478064/,推荐,2019-12-25 09:08:18,昨天看的，补一下。稍后更新。,0,江苏苏州,无签名
Cayo,https://www.douban.com/people/170836421/,推荐,2019-12-10 23:49:59,结局改编虽是无奈之举，但值得称赞的是导演做了一定巧思使得影片转向了误杀这个主题，恰恰形成了这版的精妙之处。这部电影想讲的根本不是因为女儿防卫过当造成的误杀，而是因为维杰夫妇毁尸灭迹却造成活埋的真正误杀，所以最后维杰面对警察夫妇的苦苦哀求选择了不再瞒天！,1,北京,公众号：「fumengmovie」
我放个屁给你吃,https://www.douban.com/people/64053121/,推荐,2019-12-21 21:27:58,本来觉得剧情在男主去拜神忏悔就可以戛然而止了，也觉得后面的自首完全是为了政治正确的过审准备的。但是小女儿改分数这一细节还是让人觉得，最后的自首也许真的是身为一个父亲的选择。镜头很棒，谭卓陈冲对决时，真的有种飙戏的爽感，个人觉得谭卓更胜一筹。小禽兽的死真是让我觉得大快人心。,0,北京,这世界好大呀，于是我就哭了。
what'swilliam,https://www.douban.com/people/52286623/,还行,2019-12-11 15:46:03,3星半。剧本精心算计过的完成度颇高的导演处女作。1.电影建立在一个警察被极度妖魔化的社会，普通小警察都横行霸道，按理说尚有舆论监督的情况下不应该恶成这样。2.犯罪和选举两条线互相制衡的想法很好，“真相已出但有苦难言”，可以挖更深。3.一小时后电影渐入佳境，陈冲和肖央斗法招外有招，都在预料中。4.两个失败：大女儿演技失败，坏警察角色失败，极端脸谱化。5.陈冲的扮相总是给我一种“民国感”。6.想完美犯罪吗？多看电影&平时做个好人先。7.饰演坏男孩的那个演员以后一定会红，他是《你好，之华》里的那个少年。8.电影生怕观众看不懂，剪辑很有目的性。9.电影结尾太peace了，为了上映有点可惜，陈冲的角色小崩，其实用彩蛋做结尾刚好，一个圆环。10.客串名单里我看到了小虎队的陈志朋，还有中国娃娃的娃娃？,1,福建厦门,无签名
达西先生,https://www.douban.com/people/isade/,还行,2019-12-15 13:08:33,氛围是有的，但是情节还是单薄了点，比利刃出鞘差了一两个档次。,0,广东广州,爱情像一只自由的小鸟
丹朱AI🌵,https://www.douban.com/people/59291955/,还行,2019-12-20 22:54:11,喜欢陈冲！人真的可以靠看一千部电影提高反侦察能力吗？当警察的朋友说：“不行，看三千部电影都不如进去呆仨月。”,1,北京,弦望自有时
为虾米呀,https://www.douban.com/people/2369225/,还行,2019-12-14 13:17:19,对得起这个分数，但导演你别膨胀……,0,四川成都,聊电影时，我很外向
森夏,https://www.douban.com/people/54308994/,还行,2019-12-08 21:28:25,我以前就常常想，中国审这么查严的话，以后会不会有人为了方便行事把故事放到国外拍。果然现在就有很多人这么干，导演以陈思成为首，背景地则基本在泰国。可能不好意思指名道姓老黑别国，影片改名叫“赛国”，实属无奈的架空，于是也放弃了口音管理，变成了台普，港普，普通话，泰语大乱炖，听着有点出戏。不过没想到架空，最后还得打“安全牌”，说好的拳台必须分输赢呢，“安全结局”削弱了故事的深度。影片又想搞喜剧，又想搞苦情，但完成度不太好，反而显得目的性太强，商业味太重。这点也在宣发上，底层受难就不要叫犯罪爽片了好伐，还能有点人文关怀啊，所以在煽民粹上也让我感觉在收税，对不起，我阴暗了。还有我不太喜欢泰拳和家里的那段平行剪辑。用迷影来犯罪还挺特别的，谭卓还蛮打动我的，陈冲太A了！希望所有被侮辱和损害的都能反杀！,1,江苏南京,Becoming Mancy
洛言,https://www.douban.com/people/vissonelee/,较差,2019-12-21 01:46:39,因为结局，输了原版一大截…,0,广东深圳,vistolee
popoqoqok,https://www.douban.com/people/orufe/,还行,2019-12-22 20:11:08,这个，结尾啊，真的，败笔。,0,陕西西安,敬天爱人
楼先生,https://www.douban.com/people/126762309/,还行,2019-12-18 20:57:02,陈冲陈冲！演的太好辽！小女儿要哭不哭那一段直击内心深处。国产片大部分滥用升格镜头，但《误杀》雨中那一大段却来的恰到好处，不觉得造作。结局没什么意外，不够烧。我觉得不是误杀是该杀。,1,四川成都,无签名
Typewriter000,https://www.douban.com/people/deltatrong/,还行,2019-12-16 22:38:58,事实证明中国电影人不但可以翻拍好中国电影，甚至可以翻拍好赛国电影，真是可喜可贺啊！,0,江苏南京,无签名
马里安巴,https://www.douban.com/people/lintao/,推荐,2019-12-13 22:19:29,1、一个马来西亚导演用中国资本和华语演员在泰国翻拍了一部印度电影，居然不显得违和。2、虽然被活埋很残忍，这也是男主自首的重要原因，但是迷奸女生并拍视频威胁的人渣只配得到死亡。,0,北京,Last Year at Marienbad
Locyanve阿落,https://www.douban.com/people/Ashleetiantian/,力荐,2019-12-17 22:14:54,雾草 全员飙戏 过瘾,0,北京,成年人太忙 罢了
巴士底的猫,https://www.douban.com/people/goldene/,还行,2019-12-24 21:57:56,结尾改得烂透了。节奏控制的还可以，主要的都有，次要的做了取舍。解读的更清晰了，但少了些许乐趣。6,0,北京,逝者如斯夫，不舍昼夜！
彩戏师,https://www.douban.com/people/caixishi/,推荐,2019-12-15 18:14:43,电影观影者的优势辩护,0,山西太原,春山啼鸟，秋水照花。
24city,https://www.douban.com/people/movie24city/,还行,2019-12-13 23:22:20,优点是略去了原版那些拖沓的废戏，节奏非常快，整个局布置的更聚焦，人物上父女情的表达更丰满了。缺点自然就是为了审查，不得不改变的结局，以及导演特别害怕观众看不懂而加上的那些比如时间、主角眼神等的“贴心小提醒”，反而削弱了悬疑感，最后还加了些貌似“你懂的”的台词和镜头，韵味全无。,0,北京,新的一天，旧的生活。
薛定谔的文艺猫,https://www.douban.com/people/50238914/,力荐,2019-12-15 18:23:41,改编不错,0,广东深圳,这一刻
素人冯,https://www.douban.com/people/jazzbon/,还行,2019-12-22 17:10:59,看了一小时出来处理了点工作 回去看了个结局。我老婆刚才讲了一下我落掉的二十分钟。摄影不错，故事很一般。为了过审把故事环境放在泰国，还不敢说是泰国，黑警的中文十分6，结局还来个自首，你都把环境架空了还自首。这个锅广电得背。,0,北京,电影收藏夹
Lotte Mars,https://www.douban.com/people/LotteMars/,还行,2019-12-21 22:18:35,看过一千部以上的电影，还是会觉得难及现实的千万分之一 所以这是一部愿者上钩的童话片+审查式结局,0,上海,无签名
令狐小羊,https://www.douban.com/people/56680567/,还行,2019-12-23 01:34:55,这种事如果不是发生在印度，赛国，我们拿那个警察局长怎么办呢？,0,浙江杭州,小桥报有痴人立，泪泼春帘一饼茶
夏道道＝早早,https://www.douban.com/people/48742792/,推荐,2019-12-19 20:28:24,太韩国了，真的太太太太…韩国~从海报风格、影片色调，再到叙事手法，真的好泡菜。当然，除了结局很我国（摊手）。有句讲句，谁能在看的时候不把肖央的脸代入宋饼叔，那真的算你赢~肖央是要贴跨界演技王的标签吗？成功在望了~尤其海报上那个范儿，一脸“劳资有很多演技”，我还特地翻了大图，才敢确定是肖央~😂诡计很东野，虽然结局emmm…陈冲和谭卓俩老虎母亲的对决，一秒切换动物世界！硬派演技咖掰头好过瘾！总体来说，翻拍片里，完成程度算很出色了。宽容点，啊~？！顺便，别信男主“看过1000部电影，世界上就没什么离奇的事”的理论。一个看过1000多部的过来人表示“算了吧，要智商的”。,0,陕西西安,公号：夏道道
纳兰风澈,https://www.douban.com/people/109277611/,还行,2019-12-21 06:54:34,中国特供出口转内销版《误杀瞒天记》，没印度原版拍的好真的！！！爱谭卓。。。,0,江苏南京,这世界。我……曾经来过！
我爱沙尘暴,https://www.douban.com/people/42295837/,推荐,2019-12-16 16:45:17,不错,0,四川成都,无签名
枝昂,https://www.douban.com/people/45061776/,推荐,2019-12-13 20:33:58,卧槽肖央演技可以啊让人意外！！！！,2,福建厦门,无签名
kokosweetie,https://www.douban.com/people/sweetiebaby/,推荐,2019-12-07 21:40:27,陈冲女士气场惊人，一段审讯戏看的我差点窒息了，要是拍中国版沉睡魔咒，这个黑巫女怕是要掰弯不少人。ps，肖央不搞笑的时候也很棒的啊，PPS，今日也是想生女儿的一天,1,湖南长沙,荼蘼不争春，寂寞开最晚。
影杂志,https://www.douban.com/people/100060194/,推荐,2019-12-21 21:15:32,犯罪都搬到国外了，可结局仍然没能躲过总局，非要来个认罪，显得蛋疼。哈哈，这部电影最大的价值就是，别得罪观影量超过1000的人。,1,浙江杭州,无签名
无止尘,https://www.douban.com/people/65550886/,推荐,2019-12-14 16:13:16,"陈思诚监制，唐探二外传（误）

导演很有迷影精神，各种致敬经典，“最喜欢什么电影？”“肖申克的救赎！”看笑了

两个家庭和阶层的斗智斗勇，剧情不意外，但全员演技加分

之所以说剧情不意外，除了因为“看过一千部电影，这世界上就没有什么离奇事”，更多还是因为审查制度的限制，八股文往里套就是了。完美犯罪？不存在的

证据链闭环设计得够巧妙，擦边球也打得相当准，既违法必究，又善恶有报，正面人物视角犯罪题材电影的作文模板",0,北京,告诉我一切都好
V.Dunham,https://www.douban.com/people/fuclie/,较差,2019-12-24 17:44:52,连家明都不会喜欢这么土的吧,2,Cyprus,没有学会沉默之前，我选择沉默。
Ston3s,https://www.douban.com/people/Ston3s/,还行,2019-12-14 17:53:01,国语的话~虾看的更好看🍻~没看过印度版没看过虾看的倒是可以看看~修改的部分没啥好说~,0,湖北武汉,cheers~
CeBerg,https://www.douban.com/people/C_C--321/,还行,2019-12-24 21:20:11,差点被陈冲阿姨吓哭了啦,0,北京,无签名
19431818,https://www.douban.com/people/luckystarisme/,推荐,2019-12-15 17:53:08,很精彩的一部电影，还看到了一闪而过的控方证人，看得出来导演也是个电影迷呐！就是结尾的突兀有些泄气，而且影片总给人一种刻意的感觉让人很难给五星，陈冲的表演我都担心小演员会不会有心理阴影，情节还是蛮抓人的，作为一部翻拍电影首先就有了良好的剧本基础，而导演的很多镜头特写和慢镜头都很能渲染气氛，作案手法虽然似曾相识但也算是拍出了自己的特点，总之是一部值回票价的电影,0,未知,←lucky star
洛木,https://www.douban.com/people/70161783/,还行,2019-12-15 12:39:46,原片叫《较量》，后来翻牌成《误杀瞒天记》，影响比较大，这版中国翻拍总体上还不错，就是看了《误杀瞒天记》后对于整个故事的走向都比较清楚，影响观感。更喜欢《瞒天记》，最后男主并未自首。而这版加入的自首颇有些审查的味道，当然也可以解释为男主信佛，所以自首。昨天看的《平原上的夏洛克》在片尾也出现“影片中所有涉嫌违法的皆已受到惩处”，总觉得有点黑色幽默，《心迷宫》也是……,0,四川成都,无签名
双月鲲鹏,https://www.douban.com/people/82776486/,推荐,2019-12-19 19:46:57,所有人都表现出一副用力过猛的演技，画面色调昏暗得令我感到奇怪，就翻拍来说，整体算是不错了（对国产抱着时而严苛时而宽容的心态）。就是没想到佛祖才是全场最佳，完美犯罪仍然要受到感化觉悟，必须自首走一波，犯罪分子绝对不能逍遥法外，强烈的和谐气息冉冉升起，在电影院也能感受到号召，可以说是无处不在了。,0,广东广州,一个有点自恋的神经文科男
暮雪微微,https://www.douban.com/people/54869727/,还行,2019-12-20 20:22:24,"演员是真的好，但电影看的着实难受，既然最后只能给我们这样的结局，还拍它做什么？徒给人添堵吗？
很惊喜看到边天扬和施名帅，但竟然饰演了两位人渣。",0,辽宁沈阳,晚来天欲雪，能饮一杯无？
