用户名,用户主页,推荐星级,评论时间,短评信息,投票次数,城市,用户签名
Enjolras,https://www.douban.com/people/Enjolras0712/,推荐,2019-12-14 08:38:15,好看的翻拍片不容易，上一部感觉还是《十二公民》了。原版剧本就够扎实，顺着拍不会差，而且相比原版过于漫长的铺垫，《误杀》则更快切入正题，反倒比原版更加干净利落一些，观感更爽。肖央的“犯罪手法”全部来自于电影，而陈冲也正是从他的“片单”中发现端倪。可见电影不仅能够像《猫鼠游戏》中一样教会小李子成为百变的犯罪天才，更加能够透露一个人深藏心底的秘密，所以说“书单”、“片单”、“歌单”等等，真的是一种很私人的东西，别再到处推荐或求推荐了。值得注意的是，影片的监制是陈思诚，导演柯汶利也是网剧《唐人街探案》导演之一，陈思诚这波人到底要干什么，越来越有趣了，春节档《唐探3》见吧~,5,广东广州,make each day count
流浪の小圆头,https://www.douban.com/people/aaaaaaaaaaa/,推荐,2019-12-10 22:16:59,我要把豆瓣观影记录都删了。,7,北京,立志做个无用而有趣的人
小A,https://www.douban.com/people/AngelinaAnne/,推荐,2019-12-21 12:35:44,“哪里有压迫哪里就有反抗”的意识形态永远好用。在此基础上剧情一张一弛，有冲击力的信念和行动持续推进故事。只有非常熟悉类型片套路和观众心理的编导能提炼出上述内容，把它打造成非常好的院线片，比如陈思诚，他主导的类型片基本不会跑偏，值得学习。陈冲老师演得太好了！黄健玮瘦得认不出。美中不足是剧情设计还有些粗糙冗余。片中提到男主角反复给大家讲故事加深印象。这也是银幕写作经常使用的手法，比如全片大概五次提到羊，一开场就不遗余力让男主角说“XXX是电影里说的”以增加这些梗的可信度。,1,北京,Poor you...
魂,https://www.douban.com/people/78957039/,还行,2019-12-05 22:26:27,【C+】拍的很对路人口味，基本上把原版的优点尽可能保留下来了，还不乏进一步的煽情。陈冲的表演是真的出色。不过也有明显的瑕疵，尤其是好几个人的台词太出戏了。。估计票房能卖吧。,4,广东深圳,无签名
河狸,https://www.douban.com/people/helizhanglao/,力荐,2019-12-10 23:20:44,原版号称印度版《嫌疑人X的献身》，所以难免会拿来作比较，从推理的技术层面，本片的手法要差很多，勉强说得通而已。但是从剧情到动机再到思考，都要甩出《嫌疑人》几条街。亲情和爱情真的是无法同日而语的话题。最后棺材盖上的抓痕真乃神来之笔。,6,辽宁沈阳,努力写稿赚钱买别墅！
touya,https://www.douban.com/people/touya0229/,还行,2019-12-13 21:20:12,一个看过上千部电影不信邪的人与一个办过上千件案子不信邪的人的对决。这部片子已经在国内审查允许范围内做了够多，情感内核与行为模式是《嫌疑人X的献身》式的，加入迷影情结还多了分趣味，查观影记录看似荒诞倒也有用~（并没有提给出明确画面的[控方证人]）陈冲气势好足！朋友们多看电影好处多多啊，所以印度原版也可以看起来了~三星半,2,北京,电影，湖人，陈奕迅，DC。
夏饺芹,https://www.douban.com/people/haowanluoluo/,推荐,2019-12-14 17:27:55,羊羊做错了什么！！！,4,上海,无签名
iriselite,https://www.douban.com/people/iriselite/,推荐,2019-12-07 16:55:56,出乎意料地好看，故事情节紧凑，观片量1000+就有更多机会！不剧透了。,20,上海,微信公众号：引力波美术馆
玩酷子弟,https://www.douban.com/people/kikikaikai/,推荐,2019-12-16 15:24:12,查你们一年的观影记录,1,广东汕头,你爱谈天我爱笑 呵呵
兔子,https://www.douban.com/people/159668972/,推荐,2019-12-13 19:51:42,超出预期的电影 四星推荐 可能是今年看的点映场最好的一场了,3,辽宁沈阳,无签名
Lobgran,https://www.douban.com/people/92823173/,还行,2019-12-05 22:08:28,还挺迷影向的，查观影记录那块我要笑喷了，好像拍给所有豆友，所以各种“致敬”自然避免不了，不过结尾真的不是在抄药神吗？这部才更像唐人街探案1的续集吧，最出彩的都是小女孩。也不知道谭卓是没把这个戏当回事还是用力过猛，整个人还是烈火英雄的状态，肖央的确还不错，本来以为秦沛又是出来赚赚外快没想到最后一个镜头吊打一众。倒真的还挺行活儿，表面挺能唬住人，不过有点徒有其表的精致，说两个细节：在陈冲用的手机是19年新款的同时，他的儿子和同学用的还是3G时代的智能机，这个明显手机厂商广告费没给到位啊；另外肖央谭卓俩人为啥女儿这么像个泰国人？片子核心立意蛮好的，可到结尾又开始糊弄，以及没想到不仅不能发生在中国，连泰国都不行，得在“赛国”。,5,上海,无签名
栀颜要happy呀,https://www.douban.com/people/151723273/,力荐,2019-12-18 21:00:14,陈冲和谭卓就是我女神！太会演了！美中不足的是大女儿全程出戏……,5,"Firenze, Italy",无签名
阿尔法,https://www.douban.com/people/abc1985/,还行,2019-12-26 07:45:26,不逼到绝经，影迷们都不知道自己到底能杀多少个人！,1,黑龙江哈尔滨,一约既定，万山难阻
沉默,https://www.douban.com/people/champloo/,推荐,2019-12-07 21:04:42,万万没想到这么好看，大大超出预期，肖央竟然是演技派。电影的节奏很好，就在我疑惑，中国的犯罪类型片竟然要出现一个主角逃脱法律制裁结尾的时候，果然还是自首了。所有细枝末节的线索都很好的扣主线了。,8,北京,语虚何以言知
自行车飞奔,https://www.douban.com/people/gonewiththebike/,力荐,2019-12-18 16:16:12,二号去看拳，晚上住旅店，三号去餐厅，然后看电影,5,北京,无签名
无人应答,https://www.douban.com/people/2349644/,还行,2019-12-11 23:56:26,毕竟是改编自印度经典片，剧本扎实，节奏极佳，肖央、谭卓演技出色，陈冲最赞。前半部分调色好渣，黄到怀疑人生。宣传思路吊诡，明明可以大做观影团刷口碑，不但不做最后还有陈思成无差别喷豆瓣网友轻松招黑🙄️,4,北京,人类本就需要不同的声音。
Mallory,https://www.douban.com/people/mallory/,较差,2019-12-18 21:43:43,一部哪哪哪都不对的电影，全凭陈冲（和姜皓文）演技撑着，肖央的表演完全不对。矛盾冲突，情节推进也是小学生般幼稚。最后暴动？自首？这片子简直是辱泰了。沛哥演得有点过头。,5,上海,Lost in pictures
宇の航,https://www.douban.com/people/yuhang123302/,推荐,2019-12-16 09:59:35,《误杀》结尾让我想到《看车人的七月》，不过总体看不如后者。陈冲最后的性格变化也太大了，结尾男主演选择替女儿顶罪，为何不直接顶罪，可能这样故事的效果性差点，刻意的使出一套“瞒天过海”计，好看够悬疑却不一定真实。,2,吉林长春,荡子精神，贤人行径
村里种树,https://www.douban.com/people/lexy1120/,推荐,2019-12-11 20:28:15,3.5吧 喜欢小女孩 喜欢海报 陈冲演技还是🉑️ 谭卓肖央也在及格线以上 我要去看蒙太奇了,4,四川成都,人生不需要做这么辛苦的事。
我是国王,https://www.douban.com/people/115602389/,还行,2019-12-15 23:22:23,鸡贼的陈思诚,1,"Luanda, Angola",无签名
darkcat,https://www.douban.com/people/darkcat/,推荐,2019-12-14 17:13:59,爱看电影是件有用的事儿,4,未知,喵了个咪
亲切的昊子,https://www.douban.com/people/liuzixu/,推荐,2019-12-08 16:35:40,剧本真的很赞，翻拍改编的也极具我国特色。真正意义上的『完美犯罪』，前后呼应，细节满分，特别是贫民原生家庭与执法强权在选举大背景下的对立，悬念重重又扣人心弦，有趣的还是主角迷影这个爱好。电影的人物塑造、线索伏笔以及符号隐喻都干净利落，算是近几年难得一见的国产好翻拍。,10,"P'yŏngyang, North Korea",无签名
Zcc911,https://www.douban.com/people/Zcc911/,还行,2019-12-13 22:50:31,会员福利专场@深圳百老汇影城购物公园店5号厅,1,广东深圳,100 billion people once alive.
凉心,https://www.douban.com/people/172498093/,立荐,2019-12-17 22:43:53,"东南亚太惨了，因为临近一个实际上世情复杂的大国实行严格的影像与叙事的文化审查，该国世情的大众电影讲述就不得不得转移到文化与视觉有一定相似的邻国，实际上是创作者不得已而为之的策略。于是，大国电影所不能叙说的官民冲突，民间暴乱与人性的复杂就借用了邻国的时空来讲述，可以说是中国特色社会主义嫁祸了，一个weird时代的魔幻文化症结。

然后剧作，特别是第三幕其实不太行的",2,Aland Islands,无签名
budaphin,https://www.douban.com/people/Budaphin/,推荐,2019-12-10 22:06:28,抛开翻拍这层剧本外衣，这片子拍得也是相当优秀啊，节奏把控得很好，完全出乎意料！试听呈现很震撼（推荐杜比厅），全程抓人，头皮发麻，手心出汗，是国产类型片各个维度上的突破，没想到会这么成熟，希望票房能嘉奖这份努力。里面迷影的小设计都很爱，近一年的观影记录真的能暴露很多问题，不虚！,6,北京,光影下的集体记忆
张大水,https://www.douban.com/people/1693422/,推荐,2019-12-22 21:43:55,调查观影记录的时候，应该植入一个豆瓣的软广。,3,湖北武汉,无签名
叩歌,https://www.douban.com/people/62604143/,力荐,2019-12-13 18:50:31,1、虽然看过原版明白套路，但这部翻拍得还是令人情绪激动，节奏紧凑，戏剧张力十足，很快就把你拉进营造好的紧张氛围中；2、原版中最叹为观止的是作案手法，利用电影的视觉假象瞒天过海，这部强化了迷影认知，蒙太奇剪辑的镜头十分惊艳；3、如果说原版注重案件的反转带来的快感，那么《误杀》则更注重“人”和人性复杂度的挖掘，也就是说原版能让你记住事件，这部让你记住肖央这个角色，他的人物心理、社会身份上有了更大的延展空间，而肖央在各方面都完成的很出色；4、陈冲的警察局长气场强大，几场气势之间的交锋看得过瘾，看到后面犯罪已经不是重点了，而是看个体如何扳倒强权、弱者如何反杀强者。,3,北京,岁月长，衣裳薄。
马掰掰,https://www.douban.com/people/maboxian/,还行,2019-12-16 23:29:00,原来是个氛围电影，那还不如做得更极致一些，直接把人物搞得漫画感强点。情节bug还是有的，悬念也很容易猜，镜头的目的性太强了，意外感不强。拉个影单出来，筛出目标电影，对着电影情节直接把男主的犯罪思路口述一遍，这段太败笔了。挖坟挖出一只羊就正常了？？？,3,上海,不拉屎的美少年。
胖斌plus,https://www.douban.com/people/sunbin4030/,推荐,2019-12-10 01:31:23,陈冲的“杀气”实在太强大了，强大到可以把警察局里的老爷们儿们秒成一众废物点心！强大到可以跟为母则刚的谭卓上演贴面对杀！肖央的演技也是好到无话可说！好到面对女王陈冲的霸气可以做到视若无睹毫无畏惧！影片的选题角度真的不错，肖央利用人的错位记忆制造出一份堪称完美且真实的不在场证明，又懂得利用舆论为自己的证明提供了最强助攻，而最终的结果就是把他与陈冲之间的矛盾直接升级成了警察与民众之间长期积存的矛盾，陈冲不仅连连败退更毫无还手之力。但后面的故事像是泄了气的皮球完全转换了调性开始变得疲软，陈冲的女王人设也略有崩塌让人觉得不免有些可惜。另外，肖央的那句台词：我是一个没用的男人，没什么本事，能做的，只有挡在你们前面。真心是戳在了我的泪点上了，这大概也说明了为什么街坊四邻会甘愿为他作证的原因吧。,8,北京,做我喜欢的！写我想写的！就酱~~
火龙果不耐受者,https://www.douban.com/people/flower21/,推荐,2019-12-23 10:30:31,陈冲真适合演恐怖片,1,重庆,Shit happens everyday though.
唐小万,https://www.douban.com/people/imecstasy/,还行,2019-12-14 22:45:27,好久没看陈冲演这么带劲的角色了。导演制造悬念只有强推试听那两下子，以及“查他一年的观影记录”真的笑场了。,3,北京,无签名
独行睘睘,https://www.douban.com/people/62590377/,推荐,2019-12-17 20:52:43,对选举的利用颇值得玩味。,2,湖北武汉,活过、读过、写过、恨过、爱过。
MY BMM,https://www.douban.com/people/2471325/,推荐,2019-12-14 22:47:21,有的孩子是孩子，有的是禽兽,2,北京,尽管身心疲惫，还是努力活下去
老罗Lazzaro,https://www.douban.com/people/lazzaro/,还行,2019-12-15 21:38:52,翻拍主线基本没有改动，悬疑节奏的掌控还可以。泰国的背景设置搭一票国语泰语混说的警察百姓显得比较怪，包括最后强添的特色部分和留给悬念的尸在何处，当然原因都懂。一声喝令查观影记录，差点没变喜剧，豆瓣人自明。,1,广东广州,好影是一种情怀。
LoVe,https://www.douban.com/people/Veronicam/,还行,2019-12-22 23:35:48,很愉快的感觉,0,北京,无签名
Wonder,https://www.douban.com/people/153962106/,还行,2019-12-10 20:02:14,蒙太奇拼贴式悬疑片，导演留了大量的“影迷彩蛋”。ps.冲姐和小萝莉全场最佳。,2,北京,无签名
||:da da da:||,https://www.douban.com/people/60734053/,还行,2019-12-14 00:31:43,6.5分。最后投案自首就直接影响整部电影的高度了，遇到这种事到底应该怎么办！？无奈啊，无奈啊……,4,四川成都,这个世界还是很有趣的 ~
蒜 | BOY A✎,https://www.douban.com/people/movie007wn/,推荐,2019-12-22 17:54:58,终于知道这部电影在豆瓣为什么如此高分了，（陈思诚太油腻了，影片前后都要凸显自己的监制身份，比原版低0.8那是因为你依葫芦画瓢，还想超越不成），除了原版剧本和不差的演技，影片用了迷影成分在豆瓣拉情怀分（我就知道那句“给我查他一年的观影记录”要成为热门短评），整个观影过程确实很爽，蒙太奇运用得炉火纯青，想看原版,2,四川成都,给我一双筷子，可以吃下整个地球
忘我洗澡,https://www.douban.com/people/runqueen/,推荐,2019-12-05 21:22:52,节奏还可以的翻拍片。陈冲太过优秀，对比之下谭卓这个角色的设计显得太功能性，行为模式也不太立得住。结尾大大减分，但是纠结了一下，太喜欢陈冲的表演了，给四星吧。,2,广东深圳,暗黑系土豆美少女
Connie,https://www.douban.com/people/tiffany0715/,力荐,2019-12-08 16:36:34,看的点映，不错！肖央演的很好，整个氛围烘托的好紧张。,14,湖南长沙,极简主义
P0P,https://www.douban.com/people/prost/,推荐,2019-12-19 02:46:44,★★★☆我是李维杰所以很正常的不爽结局了即使结局修饰得比较巧妙。如果一个演员用力过度那是演员的问题如果一群演员用力过度那就是导演的问题。煽情部分真的有点太多了。片子最好的部分是节奏。最喜欢的镜头是两个母亲在警察局几秒钟沉默的剑拔弩张。最佳表演奖是警犬，第二次去李家搜索的时候的表情。陈冲有一个侧面的全身制服镜头——身材好得瞬间脱戏…想看大女儿去演泰拳拳击手。,0,未知,ฅ(´ᴥ`=)
兔子和小霸王,https://www.douban.com/people/smart-ass/,推荐,2019-12-14 02:21:02,误杀皮囊下的爱与救赎 放在中国可能故事有点牵强 但发生在泰国可能挺合理的 实际作案是二号夜晚 利用语言暗示让一堆人无意间做了伪证挺有意思的。,1,中国澳门,life sucks
靡菲斯特.,https://www.douban.com/people/Naomiwatts-2006/,很差,2019-12-18 18:50:32,x,2,"Tehrān, Iran",无签名
倚风帘,https://www.douban.com/people/39279260/,推荐,2019-12-08 14:48:45,"从天而降的佛掌覆于头顶，是善；从下至上站起的魔把光都遮住，是恶。善是真诚，是保护；恶是欺骗，是霸权，可善恶还是那么难以区分。忏悔的钟在头顶敲响，心中的良知最终还是被唤醒，可那些为了助善而起义的人如何自处？秦沛就是脸被打的最重的那个，他的心，犹豫了。
电影是翻拍，有了一个好的剧本，再加上影帝影后级别演员的演绎，导演只要不犯错，就肯定是一部好电影。当然最棒的肯定是谭卓和陈冲的直接对峙，飚演技飚到天上了，叹为观止，一身鸡皮疙瘩。",2,江苏苏州,无签名
彩心之境,https://www.douban.com/people/120489754/,推荐,2019-12-22 21:33:01,"B。整体剧情没有问题，这得益于原版剧本编排完善。
关于羊这一意象运用很成功，对理解剧情和引申内涵都有重要作用，但是bug在于羊的尸体被埋了那么多天，怎么没有什么腐烂的痕迹?
为了过审改变结局也可以理解，不过编剧对父亲这个角色的塑造还欠火候，原版把一个为了保护自己小家圆满平安“对抗”权贵的父亲形象立得很足，所以他的一切行为都有很多的理由和情感支撑，剧情看下去就会觉得理所当然，但是翻拍版本里，肖央自首后对女儿的独白就显得有些尴尬刻意。
电影对蒙太奇的运用比较成功，声乐配合画面切换的确营造出紧张的观影体验。利用光影成功凸显树立人物形象，最明显的是对陈冲饰演的警长形象塑造，第一场审讯和最后对小女孩的恐吓质询，在光影运用下更显人物的可怖，当然这也离不开陈冲本人精湛的演技。",2,广东深圳,无签名
小牛魔王,https://www.douban.com/people/nmw/,力荐,2019-12-07 16:08:20,看完觉得是满分好片，晚上再注意到英文片名直接给主创跪了。一次成功的翻拍，陈思诚从不失手，肖央演技炸裂到连一旁的谭卓都显得黯淡了很多。 完美云太狼,15,北京,无签名
灃湮。紀。南城,https://www.douban.com/people/ki-jlp/,推荐,2019-12-07 21:38:01,看爸爸，妈妈，局长这三位飚戏太爽了，剧情，镜头，剪辑都很棒，完成度很高，算本年度很不错的悬疑片，但这个结局扣掉一星，设定在泰国不应该是这样的结局吖，且加上彩蛋是不是有点矛盾？←_←,3,广东深圳,早晚有点初秋味道了
Lyn 【歆恒】,https://www.douban.com/people/lynxiv/,还行,2019-12-22 22:37:41,开场几分钟立马发现了这竟然是印度片的翻拍。虽然我哦没看过原版，但谷阿莫的视频实在太令人印象深刻，太搞笑了！导致我一直难以融入这个翻拍的凝重气氛中。。。ps:这个结局我不喜欢,1,广东广州,嗯？
架构师,https://www.douban.com/people/matlab/,力荐,2019-12-20 23:21:06,《唐人街探案》涉及推理的部分不超过30分钟，15分钟足够讲清楚所有诡计，剩下的是无休止的注水，但作为贺岁片，图个喜庆欢乐的气氛外加一点推理元素也知足了。《误杀》把国产推理片推向全新的高度，猫眼9.5分，100分钟的长度全都贯穿着推理与诡计。那边《唐人街探案》在游山玩水的时候，这边《误杀》在推理；那边《唐探》用闹市追逐戏凑长度的时候，这边《误杀》在推理；那边王宝强在装疯卖傻制造无厘头笑点的时候，这边肖央满脑子思考的，仍然是如何用推理摆脱困境。对本格推理的痴迷，使得人越是卷入复杂难解的事件，越感到精神振奋，决心用自己的智力与它对抗。,0,未知,无签名
北温带英格兰,https://www.douban.com/people/50733430/,推荐,2019-12-11 21:35:39,"剧本出彩，案件和剧情并不复杂，但故事线条清晰，糅合度和递进的节奏密合，并不给人勉强感。对“蒙太奇”的二次解读也有意思——浅浅一层，看着装腔作势，可放那登对。

陈思成这人，不得不承认他有种可贵能力：接地气。不是直坠灰尘，而是油炸食品般，你说它垃圾，但就是好吃，用一种恰到好处的油烟味勾勒了小人物的市侩、轻佻、算计、穷开心和窘迫的善意，随后尴尬一笑忍俊不禁，毫不苦逼。因而经他手出品的电影都可喜地拥有这种气质，虽装腔作势、屌丝，但装得摆谱，古龙；屌丝得得意，忘形。

多好。至少我真看不下去太苦逼的东西。

结尾处煽情维稳上价值不知是不是原片自带，出戏之余也能理解，甚至疑心是为了“过审”而为之？整体属于一气呵成的“好看”之作，尿点有，憋过去就行。

PS.“替罪羊”，小羊，肖央，莫名笑一路，好冷……",4,上海,无签名
soul迪尔,https://www.douban.com/people/warfilm/,推荐,2019-12-22 16:33:45,结局又回到了传统的天朝结局模式,0,上海,战争片吧了解一下
China-周先生,https://www.douban.com/people/189043773/,还行,2019-12-09 23:28:46,肖央先生的演技终于爆发出来了，经历了老男孩、老男孩猛龙过江、唐人街神探、情圣、唐人街再神探、天气预报后，终于从一个失意的屌丝老男孩变成了男人！,6,安徽合肥,无签名
zhang 2nd,https://www.douban.com/people/zhanger/,推荐,2019-12-13 14:06:23,看片量上千的影迷牛逼了，别惹。给我查他一年的观影记录！这句台词笑死了,1,北京,人各有路………………
鱼翅哥,https://www.douban.com/people/89752149/,很差,2019-12-16 02:48:18,"不好意思，冲结局，负分滚粗！
刚又看了陈思成的宣发发言，装JM高级啊，还对评分不满.....就这样的和谐电影7分都算高的了，还跟原著比，我客观点说，开头，中间，中后半段拍的都还行，甚至还有剪辑拼接两天时间的原创片段，都不错。但就结局，毁了所有！前边所有剧情都站不住脚了。再次强调，给1星不是黑你，是因为没有0星！",5,未知,无签名
孤岛影者,https://www.douban.com/people/Century_Movie/,还行,2019-12-13 23:16:09,三星半。作为翻拍作品非常用心，有自己那一套东西呈现。相比原版个人更喜欢这部，虽然配乐问题大同小异，但流畅度改善挺大，细节也很是丰富——经典电影的多次呈现，最终回归所谓的“围墙”，以及多次出现的羊（目击羊、替罪羊等转折，还包括课堂讲解→对应英文片名）。此外如《小丑》般情况的恶化，必定有人会联想到一些影射，因此改编在情感更完整的基础上，还更加关注到现实体制问题。只是收尾还是次了些：而且不是过审的问题，而是时间（生命流逝）上的多余，以及空间（地点呈现）上的缺失。演员自然陈冲最具亮点，而其他大多平平无奇。,1,浙江杭州,一座孤岛，一位影者
高等游民阿朽,https://www.douban.com/people/fuxiu/,还行,2019-12-10 23:23:08,爽片，预测票房会爆。,4,"Reykjavík, Iceland",无签名
雪,https://www.douban.com/people/1282175/,很差,2019-12-21 23:24:49,导演是想说这是一部顶一千部的电影吗？,1,上海,实而不华
小重山,https://www.douban.com/people/43503664/,很差,2019-12-22 03:09:40,照抄而已，完全照抄。唯一脱离《误杀瞒天记》自我发挥的地方就是结尾，但这结尾的狗尾续貂使全片意义顿失。一分给久违的陈冲和一样演得很好的男猪。,1,广东广州,平生每好居人后，今日还应让弟先
文白,https://www.douban.com/people/46815070/,还行,2019-12-11 23:34:22,2.5。相较于原版有做的好的地方，比如简化前面的家庭戏份，陈冲和谭卓两位的表演，以及开棺后的暴动场面，但带来的问题也很多，肖央为何要冒险戏弄警察？这与他开始的人设不符。最要命的问题是，结尾肖央的做法基本上只能带来一种结果：把老婆孩子送进监狱，人设彻底崩掉。这是什么样的脑回路才想出来的结局？,4,广东广州,无签名
Wongwongwong,https://www.douban.com/people/sevenready/,力荐,2019-12-25 20:49:42,4.5；电影前段，妈妈叫大女儿平平，我还想咋这么平庸的名字，后来发现小女儿叫安安，平平安安，父母对子女多么质朴的愿望！内牛满面（泰国ZF也不管管 就这么让中国人瞎拍乱黑 哈哈哈）,0,北京,无签名
Tom,https://www.douban.com/people/eokmiamia/,还行,2019-12-24 19:09:10,悬念设置很巧妙，但是警长和父亲之间的对决处理太简单了。,0,湖南郴州,.
美人鱼头,https://www.douban.com/people/50563925/,推荐,2019-12-11 22:10:09,泰国背景，性侵录像，深夜刨坟，埋尸，腐警，这些元素组合在一起，还是很好看的，难得的国产推理悬疑片。彭冲的演技还是很到位，气场十足。如果没有最后的忏悔与自首，可能会更好，但是也过不了审了。什么时候国内能上一部犯罪杀人但是没有自首的片儿？,3,福建厦门,无签名
